{
  "schema_version": "0.1.0",
  "evidence_state": "proof_not_started",
  "evidence_origin": "repository_template",
  "repository_commit": null,
  "deployment_commit": null,
  "commit_match": false,
  "service_identifier": null,
  "proof_mode": "disabled",
  "durable_storage_attested": false,
  "restart_persistence_verified": false,
  "proof_access_control_verified": false,
  "public_discovery_disabled": false,
  "state_ping_402_observed": false,
  "state_ping_payment_verified": false,
  "state_ping_settlement_observed": false,
  "state_ping_delivery_observed": false,
  "context_delta_402_observed": false,
  "context_delta_payment_verified": false,
  "context_delta_settlement_observed": false,
  "context_delta_delivery_observed": false,
  "network": "eip155:8453",
  "asset": "0x833589fCD6eDb6E08f4c7C32D4f71b54bdA02913",
  "settlement_references": [],
  "replay_denial_verified": false,
  "cross_request_replay_denied": false,
  "idempotent_redelivery_verified": false,
  "kill_switch_verified": false,
  "rollback_path_attested": false,
  "telemetry_observed": false,
  "incident_controls_observed": false,
  "proof_started_at": null,
  "proof_completed_at": null,
  "authority_effect": "none",
  "public_activation_effect": "none",
  "buyer_demand_effect": "none"
}
